{"baseline_sha":"a82c405e5d19fac95543a2e3faae14f81e3217f2","external_contracts":[],"plan_key":"structure-provenance-repair-20260812","plan_version":"v1","profile":"code-dataflow","project_id":"lattice","schema":"lattice.todo_structure_set.v1","structure_set_digest":"1e86bc2e9701dc2e7e35710af0c0c126dadae7e1871c672914012550ff1c67c1","tasks":[{"applicability":"graph","planned":{"code_anchors":[{"anchor_id":"authoritative-observation","effect":"modify","expected_at":"current","path":"src/todo-structure-authoritative-observation.mjs","symbol":"collectTodoStructureAuthoritativeObservation"},{"anchor_id":"git-binding","effect":"modify","expected_at":"current","path":"src/todo-structure-git-adapter.mjs","symbol":"bindTodoStructureRealizationCommits"},{"anchor_id":"git-provenance","effect":"modify","expected_at":"current","path":"src/todo-structure-git-adapter.mjs","symbol":"collectTodoStructureGitProvenance"},{"anchor_id":"realization-append","effect":"modify","expected_at":"current","path":"src/todo-store.mjs","symbol":"appendTodoStructureRealization"},{"anchor_id":"structure-cli","effect":"modify","expected_at":"current","path":"src/todo-cli.mjs","symbol":"structureCompile"},{"anchor_id":"structure-finalize","effect":"modify","expected_at":"current","path":"src/todo-cli.mjs","symbol":"structureFinalize"}],"failures":["anchor非交差commit","baseline自身commit","current HEADから到達不能なcommit","他taskがclaim済みのcommit"],"first_live_e2e":"pre-baseline実装commitとpost-baseline証跡commitを同一realizationでstructure finalizeする","inputs":[{"access":"observe","contract":{"cardinality":"one","compatible_shape_ids":[],"identity_fields":["structure_set_digest","task_id"],"lifecycle":"immutable_artifact","schema_ref":{"json_pointer":null,"path":"src/todo-structure-contracts.mjs","symbol":"TODO_STRUCTURE_REALIZATION_SCHEMA"},"shape_id":"realization-commit-set"},"port_id":"realization-oids","source":{"constant_id":"explicit-realization-commit-oids","kind":"constant","value":["pre-baseline-implementation","post-baseline-evidence"]}}],"non_goals":["Latticeの一般plan CRUD変更","Peertable側実装変更","commit messageからの実装推定","公開・push・publish","新しいsensor/parserの追加"],"operations":[{"input_port_ids":["realization-oids"],"operation_id":"classify-and-bind","output_port_ids":["provenance-bundle"],"summary":"Git到達性とbaseline前後関係を判定しchangeset digestへ束縛する"}],"outcome":"正当なpre-baseline実装commitとpost-baseline証跡commitを、明示OIDとGit changeset digestでrealizationへ束縛する","outputs":[{"contract":{"cardinality":"one","compatible_shape_ids":[],"identity_fields":["head_sha","structure_set_digest"],"lifecycle":"immutable_artifact","schema_ref":{"json_pointer":null,"path":"src/todo-structure-git-adapter.mjs","symbol":"TODO_STRUCTURE_GIT_PROVENANCE_SCHEMA"},"shape_id":"realization-provenance-bundle"},"data_id":"realization-provenance-bundle","port_id":"provenance-bundle","sinks":[{"kind":"final_product","product_id":"realization-chain"}]}]},"task_id":"spr-01"}],"topology_digest":"8d36a330031fb94bc609a98fb1b45039295caddcb5d8e00f5ce8a7db4cd567a2"}
